text,category
"Labour's core support takes stock
 
 Tony Blair has told Labour supporters he's ""back"" and still hungry for the job of prime minister - but does that sum up the mood at the party's spring conference in Gateshead?
 
 ""The electorate are keener on the government than some Labour Party members,"" is the dry assessment of Graham Lane, leader of the Labour group on Newham Council. The problem, according to Mr Lane, is not continuing divisions over Iraq, foundation hospitals or tuition fees, or even voter apathy, but Mr Blair himself. ""I have a new slogan. Vote Blair, Get Brown. That's what I am telling people on the doorstep. Don't worry, he will be gone soon."" His friend, Saxon Spence, leader of Devon county Labour group, lays the blame for any lack of campaigning zeal on one issue above all others. ""You cannot underestimate the impact of the war in Iraq. We lost people from our local party who had some key roles.""
 
 But the two friends were fired up by Gordon Brown's speech on Saturday, with its appeal to core Labour values on social justice, health and education.
 
 ""There was real passion. I think we have all felt a little jaded, but it reminded us why we joined the party in the first place,"" said Mrs Spence. ""If he hadn't have walked off the stage, they would still be clapping,"" added Mr Lane. But for every Brownite at the spring conference there was an equally ardent fan of Mr Blair. Stephen Douglas, 26, from Wales, said after the PM's speech on Sunday: ""I think it was a bit of a turning point, given the roasting he has had on some issues. The guy still has it.""
 
 Tony Martin, of Burnley, said: ""He is the first leader who has won us two terms. This bloke has delivered for us."" Malcolm Shipley, of Shipley, said it was ""as if he is coming round to the right approach again"". Katrina Bull, a prospective parliamentary candidate said Mr Blair had shown he could rouse the party's grassroots: ""I think if every voter was able to spend time in a room with Tony, the way we have today, we will have no problem with turnout."" She had just emerged from a Q&A session, in which Mr Blair - tieless and supremely at ease - answered questions posed via the party's website.
 
 A party of councillors from Nottingham agreed that there was nothing wrong with Mr Blair's leadership - and they were adamant that the campaigning strength of the party in their city was as strong as ever. Iraq, they insisted, would not be a factor for most voters. ""The biggest problem we have got at the moment is that we keep getting all these polls saying we are going to run away with the election. ""It might sound great, but it does create this sense of complacency among our own voters and I think that is the greater problem than Iraq,"" said Nottingham City Councillor Brian Parbutt. And even Mr Blair's most vocal critics seemed to agree on one thing - he is a master of the sort of glossy, high-profile campaigning that has become Labour's hallmark, epitomised by Friday's whistle-stop tour of marginal seats. A group of shop stewards from the Swan Hunter shipyard, who said they were facing redundancy, could barely suppress their anger at Mr Blair's failure to, as they saw it, shake off his Tory leanings and stand up for manufacturing in the North East.
 
 They were also scathing about the alleged benefits of showpiece projects such as conference venue Sage Centre, heralded by John Prescott and others this weekend as a symbol of Labour's success in urban regeneration.
 
 ""It is no good having the Sage or Baltic if you haven't got the money for the entrance fee,"" said Terry Telford. But when asked about Mr Blair's bravura performance on Friday, the men agreed he was ""brilliant"". And they would all be out on the doorstep pushing the Labour message come election time. ""If you are not fired up about the election, then what's the point? There is no complacency as far as I can see in the Labour Party. We are fired up. We are up for this election,"" said Richie Porterhouse. Mr Telford agreed, but added it was becoming increasingly difficult to think of an answer when people asked ""What has Labour done for the North East?"" ""I have had doors slammed in my face,"" he said.
 
 Every activist I spoke to said they were proud of what they believed Labour had achieved in their local communities - the new hospitals and schools, the better life chances for young people. The problem they faced, they said, was converting this local feelgood factor into votes. But they could at least rely on one ""secret weapon"", as one activist put it - Tory leader Michael Howard.
",politics
"Labour's four little words
 
 Labour has unveiled the four little words that will form the heart of its general election campaign which, for those just returned from the planet Galifray, is ""looming"".
 
 The slogan ""Britain forward not back"" (no, it's not an instruction from one of those inter-planetary Time Lords) is to become as much a part of our daily lives as the sky - it's always there but we mostly stop noticing. The word ""Britain"" is cast on a red background - a nod to Old Labour. ""Forward"" is in italics and cunningly slopes forward and, along with ""not back"", is set against a mushy pea green background. As one of the journalists assembled at the unveiling declared, it was all very post modern, or something. Great use of colour. Those ad men really do earn their money. And, coincidentally, the ad men who came up with the abandoned flying pigs and so-called ""Fagin"" posters which caused Tory protests have not been sacked but, as election supremo Alan Milburn declared, ""are doing a very good job"".
 
 Mr Milburn, in the latest in his series of pre-election-campaign campaigning, explained the slogan was the reaction to polling which suggests the public believe Labour and Tony Blair are the future while Michael Howard and the Tories would take the country backwards. ""Not many people talk about the years before 1997 as the good old days,"" he declared. It would be an aggressive campaign because things would inevitably boil down to a choice between Labour and the Tories.
 
 Nobody, he claimed, could picture Liberal Democrat leader Charles Kennedy walking up Downing Street the day after polling. They could, however, picture Michael Howard or, of course, Tony Blair doing it. So it was only right that the campaign concentrated on rigorously examining the opposition's policies and past record. And Tony Blair would be in the very front line of that campaign, he said. ""Between now and the election the prime minister will be spending more time out of London than in it but in Britain, not overseas,"" he promised. ""He will be leading the domestic debate from the front, listening, taking the flak."" So, let's get on with it then.
",politics
"Chancellor rallies Labour voters
 
 Gordon Brown has issued a rallying cry to supporters, warning the ""stakes are too high"" to stay at home or protest vote in the next general election.
 
 The chancellor said the poll - expected to fall on 5 May - would give a ""clear and fundamental"" choice between Labour investment and Tory cuts. He told his party's spring conference the Tories must not be allowed to win. The Conservatives and Lib Dems insisted that voters faced higher taxes and means-testing under Labour.
 
 To a packed audience at Gateshead's Sage Centre, Mr Brown accused shadow chancellor Oliver Letwin of plotting cuts that were the equivalent of sacking every teacher, GP and nurse in the country. Laying into the Conservative's record in government he said: ""I give you this promise - with Labour, Britain will never return to the mistakes of ERM and 10% inflation, 15% interest rates, £3bn in lost reserves, 250,000 repossessed, one million in negative equity and three million unemployed. ""Never again Tory boom and bust.
 
 ""This will be the central dividing line at the election, between a Conservative Party taking Britain back and planning deep cuts of £35bn in our services, and a Labour government taking Britain forward, which on a platform of stability will reform and renew our hospitals, schools and public services and, I am proud to say, spend by 2008 £60bn more."" Turning to the economy, the chancellor promised to continue economic stability and growth in a third term in power.
 
 He also pledged to continue the fight against child and pensioner poverty. And he promised help to get young people on the property ladder. ""My message to the thousands of young couples waiting to obtain their first home is that housing is rightly now at the centre of our coming manifesto,"" he said. ""And the next Labour government will match our low mortgage rates with a new first-time buyers' initiative."" In the speech, which prompted a standing ovation, he also promised to end teenage unemployment within the next five years.
 
 He also highlighted plans for 100% debt relief for the world's poorest countries, a national minimum wage for 16 and 17-year-olds, the creation of a network of children's centres and flexibility in maternity leave. Responding to the speech, shadow chief secretary to the Treasury, George Osborne, said: ""This was more talk from Gordon Brown. ""We've heard it all before. Instead of talking about the future he kept on talking about the past. ""He completely failed to say which taxes he would put up to fill the black hole in his spending plans. ""There will be a simple choice at the election - value for money and lower taxes with the Conservatives, or more waste and higher taxes under Tony Blair and Gordon Brown.""
 
 Liberal Democrat shadow chancellor Vince Cable warned the picture was not as rosy as Mr Brown would like to portray it. ""For all his trumpeting of Labour's management of the economy, Gordon Brown's record is very mixed,"" he said. ""Gordon Brown has created a system of massive centralisation and bureaucracy, a system which subjects millions of people to means testing, and a system of taxation which is extremely complex. ""For all his positive words, Gordon Brown is faced with economic problems looming on the horizon, not least the unprecedented levels of personal debt facing the nation."" Also in Gateshead, the prime minister took questions sent in by e-mail, text message and telephone as part of Labour's attempt to engage the public in their campaign. Mr Blair told the audience he believed the Iraq war would have made Britain a safer place if its emerging democracy succeeded and that he wanted to bring troops home as soon as possible, but not before the job was done. He also said he wanted to carry on as PM ""because I still think that there are big changes our country needs"".
",politics
"Tory expert denies defeat warning
 
 The Conservatives' campaign director has denied a report claiming he warned Michael Howard the party could not win the next general election.
 
 The Times on Monday said Australian Lynton Crosby told the party leader to focus on trying to increase the Tories' Commons presence by 25 to 30 seats. But Mr Crosby said in a statement: ""I have never had any such conversation... and I do not hold that view."" Mr Howard later added there was not ""one iota"" of truth in the report. The strategist helped Australia's PM, John Howard, win four elections. Mr Howard appointed Mr Crosby as his elections chief last October. Mr Crosby's statement said: ""The Conservative Party has been making an impact on the issues of lower tax and controlled immigration over the past week."" It added: ""The Labour Party will be wanting to do all they can to distract attention away from the issues that really matter to people.""
",politics
"Brown names 16 March for Budget
 
 Chancellor Gordon Brown will deliver his Budget to the House of Commons on 16 March, the Treasury has announced.
 
 The Budget, likely to be the last before the General Election, will be at about 1230 GMT on that Wednesday, just after Prime Minister's question time. The annual event is when the chancellor outlines the government's taxation and broader economic predictions. The Tories say it is likely the Budget will contain measures to attract votes. The election is expected on 5 May.
 
 Next month's Budget will be Mr Brown's ninth since Labour came to power in 1997. If a May election is called, there could be as little as 18 days between the Budget and the announcement of a date for the election. A shortened Finance Bill would have to be rushed through Parliament with all-party support to allow the Government to continue collecting revenue.
 
 The full Finance Bill, with the Budget measures in it, would then be returned to the Commons after the election, if Labour secures another term in office. Tory shadow chancellor Oliver Letwin said: ""We can be sure of two things: the Budget will contain measures to attract votes, and it will not contain the £8 billion of tax rises which independent experts say are inevitable if Labour wins the election."" As Mr Brown announced the Budget date in a short ministerial statement, accountancy firm Ernst & Young urged him to put politics aside and focus on the long-term requirements of the economy. ""In the Budgets that were given immediately before the last six elections, taxes were cut by the incumbent chancellor and, in many cases, taxes were increased soon after the election result,"" said Aidan O'Carroll, E&Y's UK head of tax.
",politics
"Tories outlining policing plans
 
 Local communities would be asked to go to the polls to elect their own area police commissioner, under plans unveiled by the Conservatives.
 
 Party leader Michael Howard said the new role would replace ""inconspicuous"" police authorities. He said the new office would not supersede the job of a chief constable. The Lib Dems said the plan could let extreme groups run policing, while Labour criticised ""extravagant"" Tory promises on policing.
 
 Responding to the plans, the chairman of the Police Federation of England and Wales, which represents rank and file officers, said it was essential operational independence was retained.
 
 Jan Berry said: ""It is a service, not a political football to be kicked around every time an election approaches. ""These plans could result in those with extreme political views dictating what actually happens on the ground,"" she warned. Outlining his crime manifesto, Mr Howard said elected police commissioners would be more accountable than police authorities which are made up of local councillors and magistrates. ""The commissioner will have the powers which existing police authorities have,"" he told BBC Radio 4's Today programme. ""The trouble is, and it's no reflection on the people who are on the police authority - they are good people - but hardly anyone knows who they are."" Mr Howard said the authorities were not ""providing the local accountability that we want to see"" and that elected police commissioners would be more visible.
 
 Critics fear the move could hand control of the police to single-issue campaigners who would ignore the needs of the wider community. Lord Harris, who sits on the executive of Association of Police Authorities, said the plans seemed to suggest chief constables should be told what to do by a single politician. ""That is overturning nearly 200 years of the way in which we have organised policing in this country to avoid the politicisation of policing decisions,"" he said.
 
 Liberal Democrat home affairs spokesman Mark Oaten said the plan was dangerous and ""could create conflict between chief constables and elected officials"". Mr Oaten said local people had too little control over policing but a far better solution would be for elected councillors to draw up a ""minimum policing guarantee"" with their chief constables. A Labour Party spokesman criticised Michael Howard's record, saying police numbers had fallen by 1,132 when he was home secretary. He said: ""Today the Tories are making more extravagant promises on the police without making clear how they would pay for them, other than through fantasy savings to the asylum system."" The Tories insists the commissioner role would not be like that of an American sheriff. Other Tory law and order plans include building more prisons and making criminals serve full jail sentences.
",politics
"Brown 'proud of economy record'
 
 Gordon Brown has delivered a rousing speech to Labour's spring conference setting out the government's agenda for the next general election.
 
 The chancellor said he was proud of his party's record on the economy, and would strive for continuing stability if elected. The Gateshead conference was told he would help young people who were struggling to buy their own homes. And the chancellor vowed to continue the fight against child poverty. Later, Prime Minister Tony Blair will answer questions sent by the public via text and e-mail.
 
 Analysing Mr Brown's position before the speech, BBC correspondent James Hardy said Mr Brown would draw ""sharp dividing lines"" with the Conservatives for the forthcoming election campaign. He would contrast Labour's plan to invest £60bn in services with a Tory plan to cut spending by £35bn. ""Mr Brown will lay out his credentials as a reforming chancellor determined to take on and beat the Asian tiger economies which increasingly dominate world trade,"" our correspondent said.
 
 On Friday night, Mr Brown confirmed he would not make any tax commitments until the Labour manifesto had been published after the Budget, expected in March. But commentators will listen to his speech closely for hints on whether, as the Conservatives claim, he plans to raise tax after the election. The Tories accuse Labour of raising taxes 66 times since coming to power in 1997.
 
 Following the chancellor's keynote speech, the prime minister will face interactive questioning from ordinary voters on Saturday. Mr Blair is thought to be deliberately putting himself on the line in a bid to engage the electorate ahead of an expected May election. Capital Radio DJ Margherita Taylor will select questions to put to him from thousands e-mailed and sent by text. The prime minister's enthusiasm for the job remains undimmed, Alan Milburn, Labour's election strategist told Radio 4's Today programme on Saturday. Mr Blair has ""the same passion and the same commitments for the job"" as when Labour came to power in 1997, he said.
 
 And he confirmed Mr Blair's insistence that no poll date had yet been set. He said: ""I'm the General Election co-ordinator and I don't know, and Tony has not made up his mind."" On Friday, the prime minister completed a whistle-stop tour of England, during which he unveiled his party's six pre-election pledges. Starting in London, he visited marginal constituencies pledging to build on what he said were Labour's achievements on the economy, crime, education and public services. The Conservatives and Lib Dems said the pledges - set to underpin Labour's election campaign - were ""worthless"".
",politics
"Will Tory tax cuts lift spirits?
 
 Michael Howard has finally revealed the full scale of his planned Tory tax cuts.
 
 Should he win the next general election, he has earmarked £4 billion that will be used to reduce taxes - although he still will not say which or how. This was the pre-election message many in his party have been pressing for and voters, he believes, will warm to. At its simplest, it is saying: ""Vote Tory and you can have it both ways"". Not only would his government stick to Labour spending plans on core public services, including health and education, it would increase spending on defence, police and pensions. And even after that was done, it would still have enough left over for a tax cut equivalent to about a penny off the basic rate of income tax.
 
 All the money would come from its £35 billion efficiency savings which would see the axe taken to bureaucracy, waste and the civil service. Of that, £23 billion would go on spending plans, with £8 billion to fill the black hole left, they claim, by Gordon Brown, and the rest going in tax cuts.
 
 Neither Mr Howard nor Mr Letwin would say exactly how they would use that cash, although a cut in the basic rate seems unlikely. Ideas already floated include raising tax thresholds and abolishing or reducing inheritance tax, although some in the Tory party are urging Mr Howard to announce something more eye-catching before the election. As the Tory leader declared, the aim of the exercise is to open up a real economic policy divide between Labour and the Tories. ""At this election, people will have a clear choice between Mr Blair who will waste more and tax more and the Conservative party which will give value for money and tax less,"" he said.
 
 It is a move back towards an almost traditional Tory message which previously suggested Labour was the party of tax rises and the Conservatives the party of tax cuts.
 
 The extension of that, however, was that Labour was also seen as the party of big spending on the public services while the Tories were the cutters. And that is where one of the problems lies for Mr Howard - can he persuade sceptical voters that they really can have it both ways with bigger spending on public services AND lower taxes? He insists he will not promise anything before the election that he cannot deliver if put into Downing Street. Labour, needless to say, claim his planned £35bn efficiency savings simply don't add up and that those sorts of figures are fantasy.
 
 One of New Labour's greatest successes before the historic 1997 election was to persuade voters, business and the City that it could be trusted to run the economy. So far that has not faced any real challenge, but independent analysts now claim a third New Labour government would be forced to either increase taxation or taxes to plug a black hole it has at the centre of its finances. Meanwhile, the Liberal Democrats are committed to increasing taxes for the most well off to finance their spending proposals launched earlier in the day. So, Mr Howard hopes his message will start to hit home during this unofficial election campaign and that his poll ratings might finally lift off the floor. And, while other issues like the Iraq war and trust will play a major part in that campaign, it is likely - and the prime minister probably hopes - that the economy will be the deciding factor.
",politics
"'UK will stand firm on EU rebate'
 
 Britain's £3bn EU rebate is not up for renegotiation at next week's European Council summit, Jack Straw said.
 
 The foreign secretary told MPs the rebate, secured by Margaret Thatcher in 1984, was ""entirely justified"". New European commission president Jose Manuel Barroso has suggested the cash could be shared out among net contributors to the EU budget. Mr Straw acknowledged some countries in the newly enlarged 25 nation EU still had to ""see the light"" on the rebate.
 
 But the foreign secretary told the Commons foreign affairs committee: ""Our position is very clear: it is entirely justified and it is not for negotiation."" He added that he did not think there would be a political price to pay for the UK's stance - Britain contributed more and received less than other EU states. The two-day European Council summit in Brussels begins on 16 December and is widely expected to mark the beginning of a lengthy negotiating period over the EU's budget for 2007-13. The wrangling could stretch into 2005, even 2006.
 
 The UK, France, Germany, Austria, the Netherlands and Sweden want the EU budget to be capped at 1% of member states' combined national incomes - the Commission wants it to be 1.26%. Mr Straw said the EU commission's proposal would mean a 35% hike in the budget. ""I don't know of any national government thinking of increasing its budget by that amount,"" he added. The foreign secretary said he hoped the talks next week could produce a date in 2005 for the beginning of negotiations with Turkey about possible EU membership although that there would be no prospect of a date for joining for some time.
",politics
