text,category
"Schools to take part in mock poll
 
 Record numbers of schools across the UK are to take part in a mock general election backed by the government.
 
 Some 600 schools have already signed up for the Y Vote Mock Elections 2005 run by the Hansard Society and aimed at boosting interest in politics. Pupils in the schools taking part will learn the skills of speech writers, canvassers and political candidates. Schools Minister Stephen Twigg said engaging young people's interest was ""essential"" to the future of democracy.
 
 He added: said ""Young people who are engaged and motivated by the political process are essential to the future health of our democracy. ""The mock elections initiative provides an opportunity for pupils to develop their own understanding of how the democratic process works and why it matters. ""By experiencing the election process first hand - from running a campaign to the declaration of the final result - we hope that young people will develop the enthusiasm to take part in the future."" The Hansard Society, the Electoral Commission and the Department for Education and Skills are running the programme. Pupils will stand as party candidates, speech writers and canvassers. Michael Raftery, project manager at the Hansard Society, said: ""The Y Vote Mock Elections for schools mirror the excitement and buzz of a real election, raising awareness of citizenship, and the benefits of active democracy."" The mock votes will take place around 5 May, widely expected to be the date of the general election. Information packs, including ballot papers and manifesto guides, with elections happening in early May were sent out to the 3,000 schools invited to take part.
",politics
"Act on detention ruling, UK urged
 
 The government must act quickly on the Law Lords' ruling that detention of foreign terror suspects without trial is unlawful, Mary Robinson has said.
 
 The former UN commissioner for human rights and Irish president told Radio 4's Today the government's response would be scrutinised internationally. ""It would be very troubling if the government did not accept the judgement and then work within it,"" she said. Home Secretary Charles Clarke has said detainees will not be freed at present. Speaking to Parliament on his first day in office as home secretary following David Blunkett's resignation, Mr Clarke said: ""I will be asking Parliament to renew this legislation in the New Year. ""In the meantime, we will be studying the judgement carefully to see whether it is possible to modify our legislation to address the concerns raised by the House of Lords.""
 
 Mrs Robinson said the Law Lords' ruling was ""in line with international legal opinion"" and praised their ""very decisive"" eight to one majority. ""What the Law Lords did was acknowledge the role of the government, but say that there had been a disproportionate use, that it amounted to executive detention and it was discriminatory because it didn't apply to British citizens,"" she said.
 
 Mrs Robinson warned that a lack of action by the British government could lead to further action in legal arenas such as the European Court of Human Rights in Strasbourg. ""If the government were not to accept this ruling then there is further redress, including possible damages for the individuals who could claim that the government either was tardy or was resisting the implications of the judgement of the Law Lords."" She said a meeting of the Club of Madrid - a group of former world leaders - to be held in the Spanish capital on the March anniversary of the train bombings there would probably discuss the ruling and its implications. ""I have no doubt that this judgement will be looked at, both as a very positive step in clarifying the law and restating the fundamental principles, but also the response of the British government will be under quite a clear international scrutiny there.""
 
 The detainees took their case to the House of Lords after the Court of Appeal backed the Home Office's powers to hold them without limit or charge. The government opted out of part of the European Convention on Human Rights concerning the right to a fair trial in order to bring in anti-terrorism legislation in response to the 11 September attacks in the US. Any foreign national suspected of links with terrorism can be detained or can opt to be deported. The Law Lords said the rules were incompatible with the European Convention on Human Rights as they allowed detentions ""in a way that discriminates on the ground of nationality or immigration status"". The case was heard by a panel of nine law lords rather than the usual five because of the constitutional importance of the case.
",politics
"Prime minister's questions
 
 So who, if anyone, is playing politics with the security of the nation?
 
 Michael Howard has no doubt it is the prime minister who, he claims, is ""ramming"" through Parliament the controversial new anti-terror measures without proper debate. He didn't say so, but the Tories believe the prime minister is playing the fear card on this one so he can look tough in the run up to the general election And they believe Tony Blair is using the issue to suggest the Tories are soft on terrorism. Why on earth will the prime minister not simply take up the Tories' offer to extend the existing powers temporarily to allow proper parliamentary debate of the laws, he demanded. The prime minister claims this is the clearest indication that it is the Tories who are playing politics with the issue by attempting to score cheap political points in parliament. Is not the opposition against to the proposed laws ""in principle"", in which case delaying a decision for further debate would be pointless?
 
 What this is really about, believes Mr Blair, is the Tories spotting an opportunity to embarrass, maybe even defeat the government. And that is more important to them than national security. Liberal Democrat leader Charles Kennedy avoided suggesting anyone was playing politics with the issue. He preferred to state that, as with other issues like ID cards, the government's immediate instinct was authoritarian.
 
 As is his habit nowadays, the prime minister was less rough with Mr Kennedy than he had been with Mr Howard - he prefers a more exasperated tone suggesting he believes the Lib Dems have, once again, just missed the point. Apart from all that, it was electioneering as usual. The very first question to the prime minister from Derby North's Bob Laxton asked him, in effect, if he would carry on the excellent policy of pouring more resources into schools. Later Birmingham's Sion Simon even went so far as to suggest the Tories were such a shower that we should have the general election now. The prime minister almost blushed. This was not the appropriate place to announce election day, he stammered. But can anyone be in any doubt that that announcement is just days away - an announcement coming in the week beginning 4 April for an election on 5 May is where the big money is in the Commons. And perhaps that simple fact alone means everyone is seen to be playing politics with just about everything at the moment.
",politics
"Kilroy names election seat target
 
 Ex-chat show host Robert Kilroy-Silk is to contest the Derbyshire seat of Erewash at the next general election.
 
 Labour's Elizabeth Blackman won the seat in 1997 and has a 6,932 majority. She says she will fight on her record ""as a hard-working constituency MP"". Mr Kilroy-Silk announced his plans a day after launching his new party, Veritas, the Latin for truth. The East Midlands MEP, who quit the UK Independence Party, wants his new group to ""change the face"" of UK politics. His choice of election constituency quashes speculation that he would stand against Defence Secretary Geoff Hoon in Ashfield, Nottinghamshire. UKIP won 31% of the vote in Erewash in last June's European elections - with Mr Kilroy-Silk among their candidates for the region. Until 1997, Erewash had been held by the Tories since 1970. Ms Blackman said she was proud of the government's achievements in the area. She declined to give her view of Mr Kilroy-Silk at this point.
 
 On Thursday, he told a London news conference that Veritas would avoid the old parties' ""lies and spin"". He said ""our country"" was being ""stolen from us"" by mass immigration and promised a ""firm but fair"" policy on immigration. Veritas says it hopes to contest most seats at the forthcoming general election but plans to announce detailed policies on crime, tax, pensions, health and defence over the next few weeks.
 
 UKIP leader Roger Knapman says he is glad to see the back of Mr Kilroy-Silk. Labour campaign spokesman Fraser Kemp said Veritas was joining ""an already crowded field on the right of British politics"". Mr Kilroy-Silk was joined in the new venture by one of UKIP's two London Assembly members, Damien Hockney, who is now Veritas' deputy leader.
 
 UKIP's chairman Petrina Holdsworth has said the group will just be a parody of the party the men have left. Mr Kilroy-Silk quit UKIP last week after months of tension as he vied unsuccessfully for the leadership of that party. He said he was ashamed to be a member of a UKIP whose leadership had ""gone AWOL"" after the great opportunity offered by its third place at last June's European elections. UKIP's leader, Roger Knapman, has said he is glad to see the back of Mr Kilroy-Silk. ""He has remarkable ability to influence people but, sadly, after the [European] election it became clear that he was more interested in the Robert Kilroy-Silk Party than the UK Independence Party so it was nice knowing him, now 'goodbye',"" he said. UKIP officials also argue Mr Kilroy-Silk has not been ""straightforward"" in attacking the party he once wanted to lead.
",politics
"Goldsmith denies war advice claim
 
 The attorney general has denied his statement to Parliament about the legality of the Iraq war was drafted by Downing Street officials.
 
 Lord Goldsmith said Lord Falconer and Baroness Morgan played no part in drafting the answer. He added the answer represented his view that the war was legal, but was not a summary of his advice to the PM. The government has resisted calls to publish the full advice, saying such papers are always kept confidential.
 
 In a statement, Lord Goldsmith said: ""I was fully involved throughout the drafting process and personally finalised, and of course approved, the answer."" He said the answer had been prepared in his office with the involvement of Solicitor General Harriet Harman, two of his own officials, three Foreign Office officials, a QC, Christopher Greenwood and the then Lord Chancellor, Lord Irvine of Lairg.
 
 ""No other minister or official was involved in any way."" He suggested the claim that Lord Falconer and Lady Morgan had drafted the answer were the result of a mis-transcription of his evidence to the Butler Inquiry into pre-war intelligence. ""As I have always made clear, I set out in the answer my own genuinely held, independent view that military action was lawful under the existing (UN) Security Council resolutions,"" he said. ""The answer did not purport to be a summary of my confidential legal advice to government."" Former foreign secretary Robin Cook said Lord Goldsmith's admission that his parliamentary answer was not a summary of his legal opinion suggested Parliament may have been misled. ""The attorney general may never have presented his answer as a summary, but others certainly did,"" he said. ""What is clear from his statement today is that he does not believe that it was a full, accurate summary of his formal opinion.""
 
 Earlier, Tony Blair dismissed questions about the attorney general's advice, and said his Parliamentary statement had been a ""fair summary"" of his opinion. ""That's what he (Lord Goldsmith) said and that's what I say. He has dealt with this time and time and time again,"" Mr Blair told his monthly news conference in Downing Street. He refused to answer further questions on the issue.
 
 On the question of whether such papers have always been kept confidential, Tory MP Michael Mates, who is a member of the Commons intelligence and security committee and was part of the Butler inquiry, told the BBC: ""That, as a general rule, is right, but it's not an absolute rule."" He said there had been other occasions when advice had been published, most recently regarding Prince Charles's marriage plans. The government could not pick and choose when to use the convention, he said. Mr Mates added: ""This may be one of those special occasions... when it would be in the public interest to see the advice which the attorney general gave to the prime minister.""
 
 The claims about Lord Falconer and Baroness Morgan's involvement were made in a book published this week by Philippe Sands QC, a member of Cherie Blair's Matrix Chambers. He also says Lord Goldsmith warned Tony Blair on 7 March 2003 that the Iraq war could be illegal without a second UN resolution sanctioning military action.
 
 A short statement about Lord Goldsmith's position presented in a written parliamentary answer on 17 March 2003 - just before a crucial Commons vote on the military action - did not suggest this. Former minister Clare Short, who resigned from the government over the Iraq war, said the ministerial answer was the same statement that was earlier shown to the cabinet as it discussed military action. She said the full advice should have been attached, according to the ministerial code, and demanded a Lords inquiry into the matter. The Conservatives and Liberal Democrats say they still want the publication of the full legal advice given by the Attorney General. Lib Dem foreign affairs spokesman Sir Menzies Campbell said Lord Goldsmith's statement still did not clear up the outstanding issues. ""If his original advice of 7 March accepted that military action might be illegal, how was it that he resolved any such doubts by the time the Parliamentary answer was published on 17 March?"" he said. ""Only the fullest disclosure will now do.""
",politics
"Analysis: No pain, no gain?
 
 He called it his ""masochism strategy"" in the run-up to the Iraq war and now Tony Blair has signed up for another dose of pain.
 
 The idea is simple - the prime minister goes head to head with an often hostile group of ""real"" voters in the full spotlight of the television cameras. The theory is that talking to the great British public, even if they are the ""great unwashed"", is better than having the media filter what voters hear from politicians. It is also the most effective way of showing that he is aware of real people's concerns and - on occasions - of their outright fury. Mr Blair used the tactic before the Iraq war to try to show he really was engaging with public concerns and you can expect to see it much more in the run-up to the election.
 
 Labour knows it has been damaged by accusations of spin, ""control freakery"" and over-slick presentation - sometimes from within the ranks of its own MPs. Tony Blair himself has said people complain he does not listen. Mr Blair's latest bout of flagellation came with a series of questions sessions on Five television throughout Wednesday.
 
 The trouble began on the Wright Stuff show, with Maria Hutchings marching up to him, saying ""Tony, that's rubbish"" as she tried to complain about her autistic son's school being threatened with closure. A few ""don't worries"" as Mrs Hutchings was led back to the audience averted a public slanging match - he spoke to her privately after the show. But that was only the start and later sessions produced the type of grilling not even the toughest television interviewer could produce.
 
 Writer Neil Coppendale, from West Sussex, asked of the Iraq war: ""Tens of thousands of innocent men, women and children died - how do you manage to sleep at night?"" On immigration, London teacher Diane Granger said: ""Where are you going to put everyone?"" And can you imagine even Jeremy Paxman putting the question posed by Brighton nurse Marion Brown: ""Would you wipe somebody's backside for £5?""
 
 Mr Blair tried to use the questioners' first names - and sometimes threw them off their stride by asking what they would do about the problems. Many of the newspapers have branded the exercise a PR stunt which backfired. Indeed there is a danger Mr Blair simply ends up looking ""embattled"". Conservative Michael Howard and Liberal Democrat Charles Kennedy are to be offered chances to appear in similar slots on the channel next month. Labour strategists believe more of the sessions will mean the hecklers no longer become a story and the real issues take prominence.
 
 James Humphreys, ex-head of corporate communications at Number 10, says the strategy shows frustration with the media. ""They feel they don't get their voice across and going direct to people is clearly their game on this occasion,"" he says. There are risks but the prize is tackling the trend of lower turnouts at the polls, he argues. The prime minister knows full well the potential hazards .
 
 He must remember with gritted teeth his confrontation with Sharron Storer, the Birmingham woman who harangued him over the state of her local hospital in the 2001 election campaign. ""All you do is walk around and make yourself known, you don't do anything to help anybody,"" she told Mr Blair before stomping off, refusing his pleas to discuss the issue privately. Former Downing Street media chief Alastair Campbell has described the episode as a ""bit of a disaster"" as it meant the launch of Labour's election manifesto received little coverage. But it was seen as one of the few moments when that election campaign came alive, not least because it coincided with John Prescott's even more direct contact - when he punched an egg-throwing protester.
 
 Former prime ministers too have come to grief at the hands of a persistent member of the public. The undoubted highlight of years of election phone-in shows was Margaret Thatcher discomfort on Nationwide in 1983, when viewer Diana Gould put her on the spot about the sinking of the Belgrano in the Falklands War. John Major reaped the benefits of street campaigning during the 1992 election campaign with his famous soapbox.
 
 It may have left him splattered with eggs and engine oil at times but he felt it added ""fizz"" to his campaign. In his memoirs, he also argues the strategy contrasted with Neil Kinnock's ""contrived photo opportunities"" and attempts at an artful campaign. ""He wanted to look like a prime minister. I
 
 was
 
 prime minister and I wanted a flesh and blood fight,"" says Mr Major. Mr Blair told prospective Labour MPs on Thursday that taking part in phone-ins and public meetings could ""enthuse and engage and give the public a sense of empowerment"". But he also wants to counter complaints that he has spent too much time on international affairs and foreign trips. Mr Blair recalls how Bill Clinton once advised him: ""Always remember that what people see of you in the news in the evening is how they think you spend your day."" His hope must be that voters watching him on the rack will bear out for Labour the old maxim: ""No pain, no gain.""
",politics
"Lib Dems target first-time buyers
 
 The Liberal Democrats have unveiled plans to build 100,000 new ""affordable"" homes on publicly owned land.
 
 The party's scheme would allow people to buy a share in a home through a mutual home ownership trust, as a way of getting onto the housing ladder. The Lib Dems would also encourage the conversion of existing buildings in an effort to protect greenfield sites. Labour has already announced plans to help first-time buyers and the Tories would extend right-to-buy schemes.
 
 All the major parties are focusing on the issue in the run-up to the election after a survey suggested first-time buyers could not afford a home in 92% of UK towns. The Lib Dems say their ""mutual homes"" would let people buy a share of a property, usually worth about 5% of the building costs. Party leader Charles Kennedy said the homes would be affordable because they would be built on surplus public sector land, donated by central or local government. People would also only have to pay for the cost of the building and not the land, he added.
 
 They would spend about 30% of their monthly salary on rent and buying extra shares in the property. When they moved house, they would be able to cash in on any rise in property prices by selling their share. It would also allow councils to vary discounts to tenants given the right to buy their council homes so local needs were taken into account. Mr Kennedy said: ""Mutual homes will offer people the opportunity to build up an equity stake in a home gradually, investing only as much as they can afford.""
 
 There are also plans to prevent high house prices forcing people out of their local communities. The kind of ""golden share"" used by the Lib Dems in South Shropshire could be rolled out more widely. Under the plan, councils secure deals with developers where they keep a 1% share in a property scheme so properties cannot be sold on the open market. Instead, they are sold at ""build cost"" to people who the local council decides have local needs. The party says its help for first-time buyers can be funded at no extra cost to the taxpayer. But the plans involve changing the VAT system, which the party says often makes it too expensive to renovate existing buildings.
 
 The Conservatives claimed the plans would amount to an extra tax of up to £11,000 on every new house. ""This is typical of Lib Dem hypocrisy,"" said Tory shadow local government secretary Caroline Spelman. ""They claim that they want to help people on to the property ladder, but the small print of their policies reveal how they intend to price even more people out of the housing market."" The flagship Tory proposal on housing policy is to give a million more housing association tenants the right to buy their homes. Labour has said it will allow 300,000 council and housing association tenants to buy a share in their homes. Housing Minister Keith Hill said much of the Lib Dem plans mimicked the government's strategy. ""However, as usual, the Lib Dems' proposals are completely uncosted,"" he said. Mr Hill said he also asked whether the Lib Dems would match Labour's promise to spend £42bn on making refurbishing and repair council homes by 2010.
",politics
"Blair backs 'pre-election budget'
 
 Tony Blair has backed Chancellor Gordon Brown's pre-Budget report amid opposition claims he was too bullish about the state of the UK economy.
 
 In a speech in Edinburgh, the prime minister said Thursday's report reinforced stability and opportunity. And that would be central to Labour's next election campaign, planning for which was already well advanced. Mr Brown earlier denied his economic forecasts were too optimistic - but refused to rule out future tax rises.
 
 He told BBC Radio 4's Today programme: ""No politician should make the mistake that John Major and his colleagues made in 1992 of saying no matter what the circumstances are, they can make all sorts of guarantees on every individual thing.
 
 ""That is not what politicians should do, it would not be responsible to do."" Mr Brown insisted his spending plans were ""affordable"" and he could afford to be optimistic because Britain was now a stable, low-inflation economy and house prices were now stabilising. Mr Blair praised his chancellor for his role in creating economic stability, which he said was the ""cornerstone"" of Labour's programme.
 
 In a speech at Edinburgh's Napier University, he said Labour would publish over the next few months ""a rich agenda for future policy in any possible third term"".
 
 ""In every area of work there is a detailed plan for the future, much clearer than those in 1997 or 2001. All of it fits together around common themes of opportunity, security and stability for all,"" Mr Blair said. In his pre-Budget report, Mr Brown surprised some City experts by forecasting UK growth at between 3% and 3.5% for next year. Many believe the figure is more likely to be under 3% - and fear tax rises or spending cuts, saying tax receipts have been overestimated. Carl Emmerson, from the Institute for Fiscal Studies, told BBC News: ""He thinks everything will come out in the wash and it will, in fact, be OK. We're not so sure."" David Page, of Investec Securities, said: ""His forecast that he will meet the golden rule with a margin of £8bn is way too optimistic. ""It's going to take a significant turnaround in the economy to meet these targets.""
 
 Conservative Shadow chancellor Oliver Letwin said: ""I can't find a single economic forecaster from the IMF to the Institute of Fiscal Studies who believes anything other than the chancellor has got a black hole in his finances. ""In order to deal with that he will have to raise taxes after the next general election."" Mr Letwin accused the chancellor of using ""fancy statistics"" to hide public service failures. Vincent Cable, for the Liberal Democrats, called on Mr Brown to open up the government's books to the National Audit Office, to see if he had met his ""golden rule"". ""It is very clear that there are some serious loose ends in government public spending,"" Mr Cable told MPs.
",politics
